Category	Question	Answer	Frequency Level
General Information	האם מלון NYX הרצליה מציע אינטרנט אלחוטי חינם בכל שטחי המלון?	כן, אינטרנט אלחוטי מהיר וללא תשלום זמין בכל חדרי המלון ובכל השטחים הציבוריים, כולל טרקלין, לובי וחדרים.	High
General Information	האם דלפק הקבלה במלון NYX הרצליה פעיל 24 שעות ביממה?	כן, דלפק הקבלה מאויש 24 שעות ביממה ומעניק שירותי צ'ק-אין, צ'ק-אאוט וסיוע לאורחים בכל שעה.	High
General Information	כמה חדרים וסוויטות כולל מלון NYX הרצליה?	במלון 179 יחידות אירוח מעוצבות, ובהן חדרים ברמות שונות לצד סוויטות מרווחות לנוחות האורחים.	Medium
General Information	האם במלון NYX הרצליה קיימים מתקנים מותאמים לאורחים עם מוגבלות?	כן, המלון ידידותי לנגישות וכולל חדרים מונגשים, מעליות ושבילים ציבוריים מותאמים לכיסאות גלגלים.	High
General Information	האם במלון NYX הרצליה יש חניה באתר ולאיזה עלות?	כן, חניה חיצונית זמינה בתחומי המלון בעלות של ‎₪45‎ ליום, ללא צורך בהזמנה מראש.	High
General Information	האם מלון NYX הרצליה מפעיל את טרקלין העסקים Honolulu ומהם הכיבודים והשירותים בו?	כן, טרקלין Honolulu פתוח בימים א'–ה' ומציע ללא תשלום קפה חם, יין, משקאות קלים, חטיפים ושירותי עבודה עם חיבורי חשמל ואמצעי מולטימדיה.	Low
General Information	באילו שפות מדבר צוות מלון NYX הרצליה (לדוגמה אנגלית, רוסית, עברית)?	צוות המלון מעניק שירות מקצועי בעברית, אנגלית ורוסית, לטובת חוויית אירוח בינלאומית חלקה.	Medium
General Information	האם מלון NYX הרצליה כולל טרסת גג פתוחה לשימוש האורחים?	כן, טרסת גג מרווחת עם מקומות ישיבה ונוף ים פתוחה לאורחים בכפוף לתנאי מזג האוויר.	Medium
General Information	האם מלון NYX הרצליה מתאים למשפחות ומציע חדרי משפחה מרווחים?	כן, קיימים חדרי Family וחדרים מחוברים המציעים מרחב שינה נוח למשפחות עם ילדים.	High
Accommodation & Room Services	אילו סוגי חדרים זמינים במלון NYX הרצליה (Deluxe, Executive, Studio, Suite וכו')?	סוגי החדרים כוללים Deluxe, Executive, Deluxe עם מרפסת, Grand Deluxe, חדרי Deluxe ידידותיים לחיות מחמד, חדרי Studio וסוויטת NYX האלגנטית.	High
Accommodation & Room Services	האם בכל חדר במלון NYX הרצליה יש מכונת קפה Nespresso עם קפסולות המתחדשות יום-יום?	כן, בכל חדר מוצבת מכונת נספרסו אישית עם קפסולות איכות המתחדשות מדי יום ללא תשלום.	Medium
Accommodation & Room Services	האם במלון NYX הרצליה אפשר להזמין חדרים עם מרפסת ונוף לים?	כן, חדרי Deluxe עם מרפסת וסוויטות נבחרות כוללים מרפסות המשקיפות אל הים, בכפוף לזמינות ההזמנה.	Medium
Accommodation & Room Services	האם חדרי מלון NYX הרצליה כוללים טלוויזיית 49″ עם טכנולוגיית IPTV?	כן, כל חדר מצויד בטלוויזיית ‎49‎-אינץ' חכמה עם מערכת IPTV לצפייה והזרמת תוכן.	Low
Accommodation & Room Services	האם ניתן להזמין חדר ידידותי לחיות מחמד במלון NYX הרצליה, ומה משקל החיה המותר?	כן, חדרי Pet Friendly זמינים לאירוח חיות מחמד עד משקל ‎6 ק״ג, בכפוף לתשלום ותיאום מוקדם.	Medium
Accommodation & Room Services	האם במלון NYX הרצליה קיימים חדרים נגישים לכיסא גלגלים והאם הם זמינים בכל קומה?	כן, חדרים נגישים מוצעים במספר קומות ויש לאשר מיקום רצוי בעת ההזמנה. [VERIFY]	Medium
Accommodation & Room Services	האם מלון NYX הרצליה מספק שירות חדרים ומהן שעות הפעילות שלו?	נכון לעכשיו שירות החדרים מושבת באופן זמני ולכן אין שעות פעילות מוגדרות.	Medium
Accommodation & Room Services	האם ניתן לקבל מיטת תינוק (עריסה) בחדר במלון NYX הרצליה בתוספת תשלום?	כן, עריסת תינוק לגילאי 0-2 זמינה בעלות ‎₪55‎ ללילה, בכפוף לזמינות בעת הצ'ק-אין.	High
Food & Beverage	איזו ארוחת בוקר מוגשת במלון NYX הרצליה ומהן שעות ההגשה בימי חול ובשבתות?	ארוחת בוקר מזנון עשירה מוגשת בלובי: ראשון–שישי 06:30-10:30, שבתות וחגים 06:30-12:00, עם מבחר מאפים, גבינות, דגים וסלטים.	High
Food & Beverage	האם מסעדת HAVANA במלון NYX הרצליה פתוחה לאורך היום ומה סגנון המטבח שלה?	מסעדת HAVANA מגישה מטבח בינלאומי מודרני; שעות הפתיחה משתנות ויש לאמת מול המלון. [VERIFY]	Medium
Food & Beverage	האם בלובי-בר של מלון NYX הרצליה מוגשים משקאות וחטיפים במהלך היום?	כן, ב-NIX Bistro Bar שבלובי מוגשים משעות אחר הצהריים משקאות, קוקטיילים וחטיפים קלים באווירה נינוחה.	High
Food & Beverage	האם ארוחת הבוקר במלון NYX הרצליה מוגשת עד השעה 12:00 בשבתות ובחגים?	כן, בשבתות ובחגים מזנון הבוקר נמשך עד 12:00 ומאפשר ארוחת בוקר מאוחרת.	Medium
Food & Beverage	האם ניתן להזמין שירות חדרים לארוחות ומשקאות במלון NYX הרצליה?	שירות החדרים למזון ומשקאות מושבת כעת, ולכן הזמנה לחדר אינה זמינה.	Medium
Food & Beverage	האם בטרקלין העסקים של מלון NYX הרצליה מוגשים משקאות ויחידות כיבוד ללא תשלום?	כן, ב-Honolulu Lounge מוגשים חופשי קפה, יין, חטיפים ושתייה קלה ללא תשלום נוסף.	Low
Food & Beverage	האם במלון NYX הרצליה מוגש שירות קפה ותֵה חופשי בלובי לאורך היום?	כן, עמדת קפה ותה בלובי זמינה לאורחים ללא תשלום במשך כל היום.	Medium
Food & Beverage	האם במלון NYX הרצליה פועל Snack Bar / Deli לנשנושים קלים במהלך היום?	מידע על הפעלת Snack Bar או דלי ייעודי לא נמצא במקורות המאושרים. [VERIFY]	Medium
Policies & Terms	מהן שעות הצ'ק-אין במלון NYX הרצליה בימי חול?	צ'ק-אין בימים ראשון–שישי מתחיל בשעה 15:00 ומבוצע לאחר אימות זהות וכרטיס אשראי.	High
Policies & Terms	מהן שעות הצ'ק-אין במלון NYX הרצליה בשבתות ובחגים?	צ'ק-אין בשבתות ובחגים מתאפשר החל מהשעה 18:00, לאחר צאת השבת או החג.	Medium
Policies & Terms	מהן שעות הצ'ק-אאוט במלון NYX הרצליה בימי חול?	צ'ק-אאוט בימי חול מסתיים בשעה 11:00 בבוקר לכל המאוחר.	High
Policies & Terms	מהן שעות הצ'ק-אאוט במלון NYX הרצליה בשבתות ובחגים?	צ'ק-אאוט בשבתות ובחגים מתאפשר עד השעה 14:00 בצהריים.	Medium
Policies & Terms	מהו הגיל המינימלי לביצוע צ'ק-אין במלון NYX הרצליה?	הגיל המינימלי לצ'ק-אין הוא 18, וקטינים חייבים ליווי הורה או אפוטרופוס.	High
Policies & Terms	מהי מדיניות הביטול והשינויים בהזמנה במלון NYX הרצליה?	מדיניות הביטול משתנה לפי סוג התעריף והחדר; יש לעיין בתנאים בעת ההזמנה. [VERIFY]	High
Policies & Terms	האם מלון NYX הרצליה גובה פיקדון ביטחוני בעת ההגעה ובאיזו צורת תשלום?	המלון עשוי לבצע אישור כרטיס אשראי לביטחון בעת ההגעה; סכום הפיקדון לא פורסם. [VERIFY]	Medium
Policies & Terms	מהי מדיניות חיות המחמד במלון NYX הרצליה (משקל מקסימלי ותוספת תשלום)?	כן, חיות מחמד במשקל עד ‎6‎ ק״ג מתקבלות בחדרים ייעודיים ובכפוף לתשלום נוסף מראש.	High
Policies & Terms	האם מלון NYX הרצליה מציע שירות אחסון מטען לפני צ'ק-אין או לאחר צ'ק-אאוט?	כן, שירות אחסון מטען מאובטח עומד לרשות האורחים לפני ההגעה ולאחר העזיבה ללא חיוב.	Medium
Location & Transportation	היכן ממוקם מלון NYX הרצליה ומה המרחק לחוף דבוש?	המלון שוכן ברחוב אבא אבן 19 בהרצליה פיתוח, כ-900 מטרים (כשש דקות הליכה) מחוף דבוש. [VERIFY]	Medium
Location & Transportation	כמה דקות הליכה מפרידות בין מלון NYX הרצליה לקניון ארנה?	קניון ארנה במרינה נמצא במרחק כ-10 דקות הליכה נינוחה מהמלון. [VERIFY]	Medium
Location & Transportation	מהו המרחק מתחנת הרכבת הרצליה למלון NYX הרצליה?	תחנת הרכבת הרצליה נמצאת כ-2.5 ק״מ, כ-6 דקות נסיעה קצרה ברכב או מונית.	High
Location & Transportation	האם מלון NYX הרצליה מפעיל שאטל חינם לחוף הים?	כן, בעונת הרחצה פועל שאטל חינם לחוף הים בשעות קבועות המתעדכנות בקבלה.	Medium
Location & Transportation	כמה קילומטרים מפרידים בין מלון NYX הרצליה לנמל התעופה בן-גוריון?	נמל התעופה בן-גוריון מרוחק כ-30 ק״מ, נסיעה של כ-35-40 דקות תלוי בתנועה.	High
Location & Transportation	האם קונסיירז' מלון NYX הרצליה יכול להזמין שירות מוניות או הסעת VIP ללקוחות?	כן, שירות הקונסיירז' ישמח להזמין עבור האורחים מוניות רגילות או הסעות VIP לפי דרישה.	Medium
Location & Transportation	מהו המרחק בין מלון NYX הרצליה למרכז תל אביב?	מרכז תל-אביב נמצא כ-12 ק״מ דרומית, נסיעה של כ-15-20 דקות במכונית. [VERIFY]	Medium
Location & Transportation	האם קיימות עמדות חניה נגישות סמוכות למעלית במלון NYX הרצליה?	מידע מפורט על חניות נגישות צמודות למעלית לא פורסם במקורות. [VERIFY]	Low
Activities & Entertainment	האם במלון NYX הרצליה קיימת בריכת שחייה מקורה מחוממת ומהן שעות הפעילות שלה?	כן, בריכה מקורה ומחוממת פתוחה מדי יום בין 09:00 ל-19:00 לרווחת אורחי המלון.	High
Activities & Entertainment	האם הכניסה לבריכה ולמתחם הספא במלון NYX הרצליה מוגבלת לגילאי 18 ומעלה?	כן, הכניסה לבריכה, לחדר הכושר ולמתחם הספא מותרת לבני 18 ומעלה בלבד.	High
Activities & Entertainment	אילו טיפולי ספא ניתן להזמין במלון NYX הרצליה והאם נדרש לתאם מראש?	הספא מציע עיסויים זוגיים ויחיד, טיפולי גוף ויופי; מומלץ לקבוע מועד מראש להבטחת זמינות.	Medium
Activities & Entertainment	האם במלון NYX הרצליה יש ג'קוזי וסאונה לשימוש האורחים?	כן, במתחם הבריכה מופעלים ג'קוזי וסאונה יבשה לשימוש חופשי של אורחים בוגרים.	High
Activities & Entertainment	מהם ימי ושעות הפעילות של חדר הכושר במלון NYX הרצליה?	חדר הכושר פתוח א'–ה' 06:00-22:00, ו'–ש' 08:00-15:00, לגילאי 18 ומעלה.	Medium
Activities & Entertainment	האם במלון NYX הרצליה פתוחה טרסת גג עם נוף לים לאורחים או לאירועים פרטיים?	כן, טרסת הגג זמינה לאורחים ומוצעת להשכרה לאירועים פרטיים בתיאום מוקדם.	Low
Activities & Entertainment	האם ניתן להזמין עיסוי בתוספת תשלום במלון NYX הרצליה?	כן, צוות הספא מזמין את האורחים לבחור עיסוי מותאם אישית בתוספת תשלום ובהזמנה מוקדמת.	Medium
Activities & Entertainment	האם מלון NYX הרצליה מעמיד חללי אירועים וקונגרסים לכנסים ואירועי חברה?	כן, המלון מציע אולמות אירועים וחדרי ישיבות מצוידים בטכנולוגיה מתקדמת לכנסים וימי עיון.	Medium